{
  "schema_version": "1.0.0",
  "decision_id": "6e2f8b1a-4d3c-4e5f-9a8b-7c6d5e4f3a2b",
  "policy_package": "traffic.command.authz",
  "policy_bundle_version": "2026.09.18-1",
  "evaluated_at": "2026-09-18T09:09:03Z",
  "input": {
    "role": "supervisor",
    "action_type": "signal_plan_change",
    "target": { "adapter": "simulator-signal-adapter", "entity_id": "int-03" },
    "evidence_freshness_seconds": 4,
    "command_id": "2e1a4c3b-6f5d-4e2a-8b3c-9d0e1f2a3b4c",
    "idempotency_key": "int-03-signal-plan-change-2026-09-18T09:09:00Z"
  },
  "decision": "permit"
}
